{
  "schemaVersion": 1,
  "bankVersion": "diagnostic-v1-bank.2.0.0-candidate",
  "status": "CANDIDATE_NOT_APPROVED",
  "scoringPolicyVersion": "raw-single-choice.2-candidate",
  "approvalStatus": "PENDING_HUMAN",
  "entries": [
    {
      "questionId": "diagv1.a.g1.r1",
      "formId": "form-a",
      "proposedCorrectOptionId": "opt.905bcf0725d7ba9afadb",
      "explanation": "B is the only standard complete present-simple sentence: singular subject agrees with goes. Other options lack agreement or auxiliary. Generic stem repeats G5, but options/construct differ; not a duplicated complete item.",
      "distractorRationales": [
        {
          "optionId": "opt.cd8ea76ca57f6b1e19b6",
          "rationale": "Base go lacks third-person singular agreement."
        },
        {
          "optionId": "opt.ecd7bcd3a0e0d67eafe2",
          "rationale": "Going needs an auxiliary in a complete finite clause."
        },
        {
          "optionId": "opt.7d147079f7f11ba989f2",
          "rationale": "Gone needs an auxiliary and is not simple present."
        }
      ],
      "evidence": [
        {
          "sourceId": "source-legacy-data",
          "locator": "src/data.ts:8:5",
          "quote": null
        }
      ]
    },
    {
      "questionId": "diagv1.a.g02.r1",
      "formId": "form-a",
      "proposedCorrectOptionId": "opt.10c8262aa12874691ab7",
      "explanation": "Have studied is the present perfect simple form. The instruction fixes the target and the context explicitly continues to now.",
      "distractorRationales": [
        {
          "optionId": "opt.5cb0c4bfce363e4b420b",
          "rationale": "Past simple is not the requested present perfect form."
        },
        {
          "optionId": "opt.89ca258553922c832e25",
          "rationale": "This is present continuous, not present perfect simple."
        },
        {
          "optionId": "opt.13390d6210734dc19f58",
          "rationale": "Past perfect uses a past reference point, not the requested form."
        }
      ],
      "evidence": [
        {
          "sourceId": "source-authoring",
          "locator": "Form A G02 revision of historical G2",
          "quote": null
        }
      ]
    },
    {
      "questionId": "diagv1.a.g3.r1",
      "formId": "form-a",
      "proposedCorrectOptionId": "opt.731070e2e90d897c2897",
      "explanation": "B is the conventional second-conditional past form with would learn; A/C/D do not form the intended standard conditional.",
      "distractorRationales": [
        {
          "optionId": "opt.6ce83cacea1626168a98",
          "rationale": "Have does not form the intended second conditional."
        },
        {
          "optionId": "opt.08d471640ca70b5c998b",
          "rationale": "Will have is not the conventional if-clause form here."
        },
        {
          "optionId": "opt.c280f0ddf34c1295ed8a",
          "rationale": "Would have belongs in a different construction, not this if-clause."
        }
      ],
      "evidence": [
        {
          "sourceId": "source-legacy-data",
          "locator": "src/data.ts:10:5",
          "quote": null
        }
      ]
    },
    {
      "questionId": "diagv1.a.g4.r1",
      "formId": "form-a",
      "proposedCorrectOptionId": "opt.fe30a99a27bcd9860957",
      "explanation": "C establishes the lecture starting before the past arrival. A/B have unsuitable tense anchoring; D lacks a finite verb.",
      "distractorRationales": [
        {
          "optionId": "opt.057dcd2371c4d8e9031a",
          "rationale": "Starts has present-time rather than past-before-past reference."
        },
        {
          "optionId": "opt.60a72a8fad3d0e80173e",
          "rationale": "Has started is present perfect, not past-before-past."
        },
        {
          "optionId": "opt.547331ea6dd59fde2db6",
          "rationale": "Starting is not a finite verb phrase."
        }
      ],
      "evidence": [
        {
          "sourceId": "source-legacy-data",
          "locator": "src/data.ts:11:5",
          "quote": null
        }
      ]
    },
    {
      "questionId": "diagv1.a.g5.r1",
      "formId": "form-a",
      "proposedCorrectOptionId": "opt.bb2c73f2ec1c654443e9",
      "explanation": "C combines uncountable information with singular is. A has disagreement; B/D pluralize an uncountable noun in this sense. Generic stem repeats G1 but tests different content.",
      "distractorRationales": [
        {
          "optionId": "opt.d87c5381ab8fb0134163",
          "rationale": "Are disagrees with uncountable singular information."
        },
        {
          "optionId": "opt.b72149c30d02488ded10",
          "rationale": "Informations is not the standard uncountable form."
        },
        {
          "optionId": "opt.9bf099a7439bc876ca39",
          "rationale": "Both informations and plural agreement are inappropriate here."
        }
      ],
      "evidence": [
        {
          "sourceId": "source-legacy-data",
          "locator": "src/data.ts:12:5",
          "quote": null
        }
      ]
    },
    {
      "questionId": "diagv1.a.g06.r1",
      "formId": "form-a",
      "proposedCorrectOptionId": "opt.9033ebb2ea55e2d84907",
      "explanation": "A counterfactual past condition is paired with would plus base be for the explicitly requested present result.",
      "distractorRationales": [
        {
          "optionId": "opt.b77c02ec3bc47d219620",
          "rationale": "This is a perfect-modal result, not the explicitly requested present-result form."
        },
        {
          "optionId": "opt.650e8fc89d8016f6f129",
          "rationale": "Will is not the counterfactual present-result modal here."
        },
        {
          "optionId": "opt.b74fdca33bff6c2e3894",
          "rationale": "Past perfect does not form the required result clause."
        }
      ],
      "evidence": [
        {
          "sourceId": "source-authoring",
          "locator": "Form A G06 revision of historical G6",
          "quote": null
        }
      ]
    },
    {
      "questionId": "diagv1.a.v01.r1",
      "formId": "form-a",
      "proposedCorrectOptionId": "opt.12bb2645e9700f1f2562",
      "explanation": "Rapid growth is growth happening quickly; rapid does not require a sudden start.",
      "distractorRationales": [
        {
          "optionId": "opt.26c841b67a513ad7318e",
          "rationale": "Gradual describes slow development rather than rapid growth."
        },
        {
          "optionId": "opt.3a71b0572ed04d428a0d",
          "rationale": "Uncertain describes lack of certainty, not speed."
        },
        {
          "optionId": "opt.0cd36947b509697baf85",
          "rationale": "Limited describes extent, not the speed of growth."
        }
      ],
      "evidence": [
        {
          "sourceId": "source-authoring",
          "locator": "Form A V01 revision of historical V1",
          "quote": null
        }
      ]
    },
    {
      "questionId": "diagv1.a.v2.r1",
      "formId": "form-a",
      "proposedCorrectOptionId": "opt.9646e606ec532314f496",
      "explanation": "A is the adjective modifying effect. B noun, C verb and D adverb do not fit the noun phrase.",
      "distractorRationales": [
        {
          "optionId": "opt.c96e601a585f6b6a474c",
          "rationale": "Significance is a noun, not the adjective before effect."
        },
        {
          "optionId": "opt.65575f7439a6c3de1ea7",
          "rationale": "Signify is a verb, not an adjective."
        },
        {
          "optionId": "opt.72e7b667b2ef5911cbee",
          "rationale": "Significantly is an adverb, not the required noun modifier."
        }
      ],
      "evidence": [
        {
          "sourceId": "source-legacy-data",
          "locator": "src/data.ts:17:5",
          "quote": null
        }
      ]
    },
    {
      "questionId": "diagv1.a.v3.r1",
      "formId": "form-a",
      "proposedCorrectOptionId": "opt.2e438eb339cac78c0b38",
      "explanation": "A means persuasive when modifying evidence; convinced describes an experiencer, while C/D have the wrong form.",
      "distractorRationales": [
        {
          "optionId": "opt.69f96e2b2fc9932d3eba",
          "rationale": "Convinced normally describes the person who believes, not persuasive evidence."
        },
        {
          "optionId": "opt.952f1ff3331fae047cc1",
          "rationale": "Convince is the base verb and cannot modify evidence here."
        },
        {
          "optionId": "opt.2ce0b8b901a0a836fb31",
          "rationale": "Conviction is a noun and does not supply the intended adjective."
        }
      ],
      "evidence": [
        {
          "sourceId": "source-legacy-data",
          "locator": "src/data.ts:18:5",
          "quote": null
        }
      ]
    },
    {
      "questionId": "diagv1.a.v4.r1",
      "formId": "form-a",
      "proposedCorrectOptionId": "opt.0e966201d70925e74782",
      "explanation": "C decreased matches declined for birth rates. A is the opposite, B no change and D disappearance is too strong.",
      "distractorRationales": [
        {
          "optionId": "opt.d0a350af72bd05cf4db3",
          "rationale": "Increased reverses the direction of change."
        },
        {
          "optionId": "opt.41ada69f64c58cdd7f18",
          "rationale": "Remained stable means no change."
        },
        {
          "optionId": "opt.1f08c6992bade44d8771",
          "rationale": "Disappeared means ceased to exist, a stronger claim than declined."
        }
      ],
      "evidence": [
        {
          "sourceId": "source-legacy-data",
          "locator": "src/data.ts:19:5",
          "quote": null
        }
      ]
    },
    {
      "questionId": "diagv1.a.v5.r1",
      "formId": "form-a",
      "proposedCorrectOptionId": "opt.461b6c968cf8d13fef8b",
      "explanation": "B is the standard do research collocation. Other options are not standard in the intended research-activity sense.",